[{"game_id":"2026_04_ARI_NYG","candidate":"C0","p_home_raw":0.478260869565217,"p_home_final":0.478260869565217,"p_home_mkt_novig":0.478260869565217},{"game_id":"2026_04_ATL_NO","candidate":"C0","p_home_raw":0.582992641046607,"p_home_final":0.582992641046607,"p_home_mkt_novig":0.582992641046607},{"game_id":"2026_04_DAL_HOU","candidate":"C0","p_home_raw":0.563492063492063,"p_home_final":0.563492063492063,"p_home_mkt_novig":0.563492063492063},{"game_id":"2026_04_DEN_SF","candidate":"C0","p_home_raw":0.582992641046607,"p_home_final":0.582992641046607,"p_home_mkt_novig":0.582992641046607},{"game_id":"2026_04_DET_CAR","candidate":"C0","p_home_raw":0.377533448138826,"p_home_final":0.377533448138826,"p_home_mkt_novig":0.377533448138826},{"game_id":"2026_04_GB_TB","candidate":"C0","p_home_raw":0.369059656218402,"p_home_final":0.369059656218402,"p_home_mkt_novig":0.369059656218402},{"game_id":"2026_04_IND_WAS","candidate":"C0","p_home_raw":0.369059656218402,"p_home_final":0.369059656218402,"p_home_mkt_novig":0.369059656218402},{"game_id":"2026_04_JAX_CIN","candidate":"C0","p_home_raw":0.572059635560464,"p_home_final":0.572059635560464,"p_home_mkt_novig":0.572059635560464},{"game_id":"2026_04_KC_LV","candidate":"C0","p_home_raw":0.336351875808538,"p_home_final":0.336351875808538,"p_home_mkt_novig":0.336351875808538},{"game_id":"2026_04_LAC_SEA","candidate":"C0","p_home_raw":0.747782705099778,"p_home_final":0.747782705099778,"p_home_mkt_novig":0.747782705099778},{"game_id":"2026_04_LA_PHI","candidate":"C0","p_home_raw":0.406630245840576,"p_home_final":0.406630245840576,"p_home_mkt_novig":0.406630245840576},{"game_id":"2026_04_MIA_MIN","candidate":"C0","p_home_raw":0.84,"p_home_final":0.84,"p_home_mkt_novig":0.84},{"game_id":"2026_04_NE_BUF","candidate":"C0","p_home_raw":0.70954356846473,"p_home_final":0.70954356846473,"p_home_mkt_novig":0.70954356846473},{"game_id":"2026_04_NYJ_CHI","candidate":"C0","p_home_raw":0.599638771824202,"p_home_final":0.599638771824202,"p_home_mkt_novig":0.599638771824202},{"game_id":"2026_04_PIT_CLE","candidate":"C0","p_home_raw":0.427940364439536,"p_home_final":0.427940364439536,"p_home_mkt_novig":0.427940364439536},{"game_id":"2026_04_TEN_BAL","candidate":"C0","p_home_raw":0.846501128668172,"p_home_final":0.846501128668172,"p_home_mkt_novig":0.846501128668172},{"game_id":"2026_04_ARI_NYG","candidate":"C1","p_home_raw":0.584165063652397,"p_home_final":0.584165063652397,"p_home_mkt_novig":0.478260869565217},{"game_id":"2026_04_ATL_NO","candidate":"C1","p_home_raw":0.529760265514934,"p_home_final":0.529760265514934,"p_home_mkt_novig":0.582992641046607},{"game_id":"2026_04_DAL_HOU","candidate":"C1","p_home_raw":0.620541454412171,"p_home_final":0.620541454412171,"p_home_mkt_novig":0.563492063492063},{"game_id":"2026_04_DEN_SF","candidate":"C1","p_home_raw":0.569731517090249,"p_home_final":0.569731517090249,"p_home_mkt_novig":0.582992641046607},{"game_id":"2026_04_DET_CAR","candidate":"C1","p_home_raw":0.422771279494638,"p_home_final":0.422771279494638,"p_home_mkt_novig":0.377533448138826},{"game_id":"2026_04_GB_TB","candidate":"C1","p_home_raw":0.497234158849946,"p_home_final":0.497234158849946,"p_home_mkt_novig":0.369059656218402},{"game_id":"2026_04_IND_WAS","candidate":"C1","p_home_raw":0.492829608545676,"p_home_final":0.492829608545676,"p_home_mkt_novig":0.369059656218402},{"game_id":"2026_04_JAX_CIN","candidate":"C1","p_home_raw":0.437817072638155,"p_home_final":0.437817072638155,"p_home_mkt_novig":0.572059635560464},{"game_id":"2026_04_KC_LV","candidate":"C1","p_home_raw":0.430253579780613,"p_home_final":0.430253579780613,"p_home_mkt_novig":0.336351875808538},{"game_id":"2026_04_LAC_SEA","candidate":"C1","p_home_raw":0.800596170097389,"p_home_final":0.800596170097389,"p_home_mkt_novig":0.747782705099778},{"game_id":"2026_04_LA_PHI","candidate":"C1","p_home_raw":0.499115448231899,"p_home_final":0.499115448231899,"p_home_mkt_novig":0.406630245840576},{"game_id":"2026_04_MIA_MIN","candidate":"C1","p_home_raw":0.790015240713181,"p_home_final":0.790015240713181,"p_home_mkt_novig":0.84},{"game_id":"2026_04_NE_BUF","candidate":"C1","p_home_raw":0.633059676833972,"p_home_final":0.633059676833972,"p_home_mkt_novig":0.70954356846473},{"game_id":"2026_04_NYJ_CHI","candidate":"C1","p_home_raw":0.755969775357691,"p_home_final":0.755969775357691,"p_home_mkt_novig":0.599638771824202},{"game_id":"2026_04_PIT_CLE","candidate":"C1","p_home_raw":0.454964372698195,"p_home_final":0.454964372698195,"p_home_mkt_novig":0.427940364439536},{"game_id":"2026_04_TEN_BAL","candidate":"C1","p_home_raw":0.785262676532378,"p_home_final":0.785262676532378,"p_home_mkt_novig":0.846501128668172},{"game_id":"2026_04_ARI_NYG","candidate":"C2","p_home_raw":0.526600128174423,"p_home_final":0.526600128174423,"p_home_mkt_novig":0.478260869565217},{"game_id":"2026_04_ATL_NO","candidate":"C2","p_home_raw":0.515636258480243,"p_home_final":0.515636258480243,"p_home_mkt_novig":0.582992641046607},{"game_id":"2026_04_DAL_HOU","candidate":"C2","p_home_raw":0.570518081563916,"p_home_final":0.570518081563916,"p_home_mkt_novig":0.563492063492063},{"game_id":"2026_04_DEN_SF","candidate":"C2","p_home_raw":0.741190620930469,"p_home_final":0.741190620930469,"p_home_mkt_novig":0.582992641046607},{"game_id":"2026_04_DET_CAR","candidate":"C2","p_home_raw":0.437492336261615,"p_home_final":0.437492336261615,"p_home_mkt_novig":0.377533448138826},{"game_id":"2026_04_GB_TB","candidate":"C2","p_home_raw":0.54715922216887,"p_home_final":0.54715922216887,"p_home_mkt_novig":0.369059656218402},{"game_id":"2026_04_IND_WAS","candidate":"C2","p_home_raw":0.509923858529645,"p_home_final":0.509923858529645,"p_home_mkt_novig":0.369059656218402},{"game_id":"2026_04_JAX_CIN","candidate":"C2","p_home_raw":0.443890623268204,"p_home_final":0.443890623268204,"p_home_mkt_novig":0.572059635560464},{"game_id":"2026_04_KC_LV","candidate":"C2","p_home_raw":0.352779933114706,"p_home_final":0.352779933114706,"p_home_mkt_novig":0.336351875808538},{"game_id":"2026_04_LAC_SEA","candidate":"C2","p_home_raw":0.802868424243972,"p_home_final":0.802868424243972,"p_home_mkt_novig":0.747782705099778},{"game_id":"2026_04_LA_PHI","candidate":"C2","p_home_raw":0.382833270509526,"p_home_final":0.382833270509526,"p_home_mkt_novig":0.406630245840576},{"game_id":"2026_04_MIA_MIN","candidate":"C2","p_home_raw":0.708870872541211,"p_home_final":0.708870872541211,"p_home_mkt_novig":0.84},{"game_id":"2026_04_NE_BUF","candidate":"C2","p_home_raw":0.720566407797263,"p_home_final":0.720566407797263,"p_home_mkt_novig":0.70954356846473},{"game_id":"2026_04_NYJ_CHI","candidate":"C2","p_home_raw":0.742633503606551,"p_home_final":0.742633503606551,"p_home_mkt_novig":0.599638771824202},{"game_id":"2026_04_PIT_CLE","candidate":"C2","p_home_raw":0.572733437798712,"p_home_final":0.572733437798712,"p_home_mkt_novig":0.427940364439536},{"game_id":"2026_04_TEN_BAL","candidate":"C2","p_home_raw":0.852818050656248,"p_home_final":0.852818050656248,"p_home_mkt_novig":0.846501128668172},{"game_id":"2026_04_ARI_NYG","candidate":"E1","p_home_raw":0.55556903128569,"p_home_final":0.55556903128569,"p_home_mkt_novig":0.478260869565217},{"game_id":"2026_04_ATL_NO","candidate":"E1","p_home_raw":0.522702800278716,"p_home_final":0.522702800278716,"p_home_mkt_novig":0.582992641046607},{"game_id":"2026_04_DAL_HOU","candidate":"E1","p_home_raw":0.595778543133732,"p_home_final":0.595778543133732,"p_home_mkt_novig":0.563492063492063},{"game_id":"2026_04_DEN_SF","candidate":"E1","p_home_raw":0.660710251232259,"p_home_final":0.660710251232259,"p_home_mkt_novig":0.582992641046607},{"game_id":"2026_04_DET_CAR","candidate":"E1","p_home_raw":0.43011636175736,"p_home_final":0.43011636175736,"p_home_mkt_novig":0.377533448138826},{"game_id":"2026_04_GB_TB","candidate":"E1","p_home_raw":0.522252264341718,"p_home_final":0.522252264341718,"p_home_mkt_novig":0.369059656218402},{"game_id":"2026_04_IND_WAS","candidate":"E1","p_home_raw":0.501377135958269,"p_home_final":0.501377135958269,"p_home_mkt_novig":0.369059656218402},{"game_id":"2026_04_JAX_CIN","candidate":"E1","p_home_raw":0.440851635121815,"p_home_final":0.440851635121815,"p_home_mkt_novig":0.572059635560464},{"game_id":"2026_04_KC_LV","candidate":"E1","p_home_raw":0.390828908040188,"p_home_final":0.390828908040188,"p_home_mkt_novig":0.336351875808538},{"game_id":"2026_04_LAC_SEA","candidate":"E1","p_home_raw":0.801734747360944,"p_home_final":0.801734747360944,"p_home_mkt_novig":0.747782705099778},{"game_id":"2026_04_LA_PHI","candidate":"E1","p_home_raw":0.440153544813665,"p_home_final":0.440153544813665,"p_home_mkt_novig":0.406630245840576},{"game_id":"2026_04_MIA_MIN","candidate":"E1","p_home_raw":0.751655624865806,"p_home_final":0.751655624865806,"p_home_mkt_novig":0.84},{"game_id":"2026_04_NE_BUF","candidate":"E1","p_home_raw":0.678376140387358,"p_home_final":0.678376140387358,"p_home_mkt_novig":0.70954356846473},{"game_id":"2026_04_NYJ_CHI","candidate":"E1","p_home_raw":0.749360668109088,"p_home_final":0.749360668109088,"p_home_mkt_novig":0.599638771824202},{"game_id":"2026_04_PIT_CLE","candidate":"E1","p_home_raw":0.514043838660585,"p_home_final":0.514043838660585,"p_home_mkt_novig":0.427940364439536},{"game_id":"2026_04_TEN_BAL","candidate":"E1","p_home_raw":0.821528792462618,"p_home_final":0.821528792462618,"p_home_mkt_novig":0.846501128668172},{"game_id":"2026_04_ARI_NYG","candidate":"B1[E1]","p_home_raw":0.458598893747252,"p_home_final":0.458598893747252,"p_home_mkt_novig":0.478260869565217},{"game_id":"2026_04_ATL_NO","candidate":"B1[E1]","p_home_raw":0.578500839971227,"p_home_final":0.578500839971227,"p_home_mkt_novig":0.582992641046607},{"game_id":"2026_04_DAL_HOU","candidate":"B1[E1]","p_home_raw":0.551478858192032,"p_home_final":0.551478858192032,"p_home_mkt_novig":0.563492063492063},{"game_id":"2026_04_DEN_SF","candidate":"B1[E1]","p_home_raw":0.568762885407171,"p_home_final":0.568762885407171,"p_home_mkt_novig":0.582992641046607},{"game_id":"2026_04_DET_CAR","candidate":"B